[
  {
    "data_quality_tier": "clean",
    "external_id": "PRAC-001",
    "first_name": "Anthony",
    "last_name": "Robinson",
    "npi": "2265423519",
    "practice_address": "43321 Brittany Bypass, Butler, PA 16001",
    "practice_fax": "878-555-4557",
    "practice_name": "Allegheny Community Health",
    "practice_phone": "724-555-1584",
    "provider_type": "referring",
    "specialty": "Internal Medicine"
  },
  {
    "data_quality_tier": "clean",
    "external_id": "PRAC-002",
    "first_name": "Lisa",
    "last_name": "Smith",
    "npi": "8161849590",
    "practice_address": "386 Shane Harbors, Beaver, PA 15009",
    "practice_fax": "412-555-7527",
    "practice_name": "Highland Park Family Practice",
    "practice_phone": "412-555-1139",
    "provider_type": "referring",
    "specialty": "Internal Medicine"
  },
  {
    "data_quality_tier": "messy",
    "external_id": "PRAC-003",
    "first_name": "Matthew",
    "last_name": "Davis",
    "npi": "4752553410",
    "practice_address": null,
    "practice_fax": "412-555-3814",
    "practice_name": "Mon Valley Internal Medicine",
    "practice_phone": "878-555-2803",
    "provider_type": "referring",
    "specialty": "Family Medicine"
  },
  {
    "data_quality_tier": "messy",
    "external_id": "PRAC-004",
    "first_name": "Christian",
    "last_name": "Carter",
    "npi": "5030564137",
    "practice_address": "5940 Herrera Lane, Butler, PA 16001",
    "practice_fax": "724-555-4422",
    "practice_name": "Greentree Health Partners",
    "practice_phone": "878-555-5155",
    "provider_type": "referring",
    "specialty": null
  },
  {
    "data_quality_tier": "clean",
    "external_id": "PRAC-005",
    "first_name": "Shawn",
    "last_name": "Flowers",
    "npi": "2423884966",
    "practice_address": "310 Kendra Common Apt. 164, Butler, PA 16001",
    "practice_fax": "878-555-7517",
    "practice_name": "Greater Pittsburgh Primary Care Associates",
    "practice_phone": "878-555-6543",
    "provider_type": "referring",
    "specialty": "Internal Medicine"
  },
  {
    "data_quality_tier": "clean",
    "external_id": "PRAC-006",
    "first_name": "Frank",
    "last_name": "Gray",
    "npi": "1226916694",
    "practice_address": "5341 Amanda Gardens, Monroeville, PA 15146",
    "practice_fax": "412-555-0771",
    "practice_name": "Wexford Family Practice",
    "practice_phone": "724-555-8669",
    "provider_type": "referring",
    "specialty": "Internal Medicine"
  },
  {
    "data_quality_tier": "clean",
    "external_id": "PRAC-007",
    "first_name": "Joseph",
    "last_name": "Clark",
    "npi": "4514627049",
    "practice_address": "503 Linda Locks, Washington, PA 15301",
    "practice_fax": "412-555-8797",
    "practice_name": "Squirrel Hill Family Practice",
    "practice_phone": "878-555-2927",
    "provider_type": "referring",
    "specialty": "Internal Medicine"
  },
  {
    "data_quality_tier": "messy",
    "external_id": "PRAC-008",
    "first_name": "Reginald",
    "last_name": "Robinson",
    "npi": "5288095701",
    "practice_address": "76724 John Points Suite 969, Pittsburgh, PA 15217",
    "practice_fax": null,
    "practice_name": "South Hills Health Partners",
    "practice_phone": "412-555-5947",
    "provider_type": "referring",
    "specialty": "Family Medicine"
  },
  {
    "data_quality_tier": "messy",
    "external_id": "PRAC-009",
    "first_name": "Laura",
    "last_name": "Henderson",
    "npi": "7182278243",
    "practice_address": "710 Eric Estate, Monroeville, PA 15146",
    "practice_fax": "878-555-1290",
    "practice_name": "Sewickley Family Practice",
    "practice_phone": "878-555-9938",
    "provider_type": "referring",
    "specialty": null
  },
  {
    "data_quality_tier": "clean",
    "external_id": "PRAC-010",
    "first_name": "Sherri",
    "last_name": "Frazier",
    "npi": "7871331501",
    "practice_address": "6978 Maddox Wall, Monroeville, PA 15146",
    "practice_fax": "724-555-6118",
    "practice_name": "North Hills Medical Group",
    "practice_phone": "878-555-9075",
    "provider_type": "referring",
    "specialty": "Family Medicine"
  }
]
